file_stem	source_id	selection_note
isophonics_109	beatles_taxman	compact dominant-heavy groove with altered dominant surface spellings
isophonics_111	beatles_eleanor_rigby	minor-key pop writing with inversion-rich bass motion
isophonics_113	beatles_for_no_one	applied dominant and sus-surface pop writing in a stable major key
isophonics_170	beatles_all_my_loving	classic major-key pop progression with augmented-color surface notation
isophonics_171	beatles_it_wont_be_long	mixed augmented, diminished, and dominant surface variants in early Beatles pop
isophonics_173	beatles_devil_in_her_heart	major-minor color toggles and slash-bass surface notation in a compact pop song
